{
  "$schema": "https://json-schema.org/draft/2020-12/schema",
  "$id": "https://mechaminer.local/schemas/weapon.schema.json",
  "title": "SCH-CNT-002 weapon definition",
  "description": "A weapon definition. The project-owned typed validator in src/MechaMiner.Content/Categories/ remains authoritative; this schema is the draft 2020-12 mirror kept for editor and tool interoperability, and a fixture corpus proves the two reach the same accept/reject verdict on every structural case. See content/schemas/README.md. The recipe is two resource IDs and nothing else; one weapon file carried the same two materials four times. What the ID-only recipe costs is legibility, and the compensation is a relational check that resolves each recipe resource to its canonical letter and requires the concatenation to equal the weapon's own suffix.",
  "type": "object",
  "additionalProperties": false,
  "propertyNames": {
    "$ref": "#/$defs/snake_case_field"
  },
  "required": [
    "id",
    "schema_version",
    "content_version",
    "status",
    "tags",
    "source_refs",
    "recipe_pair_material_ids",
    "behavior_kind",
    "targeting_policy",
    "rock_targeting_behavior",
    "ore_upgradeable_stats",
    "fixed_properties",
    "global_attack_rate_mapping",
    "branch_ids",
    "base_automatic_attack_text",
    "base_behavior_text"
  ],
  "properties": {
    "id": {
      "title": "A stable, case-sensitive ASCII content ID",
      "type": "string",
      "pattern": "^W-[A-F]{2}$"
    },
    "schema_version": {
      "$ref": "#/$defs/version"
    },
    "content_version": {
      "$ref": "#/$defs/version"
    },
    "status": {
      "$ref": "#/$defs/status"
    },
    "name_key": {
      "$ref": "#/$defs/name_key"
    },
    "summary_key": {
      "$ref": "#/$defs/summary_key"
    },
    "tags": {
      "$ref": "#/$defs/tags"
    },
    "source_refs": {
      "$ref": "#/$defs/source_refs"
    },
    "presentation_id": {
      "$ref": "#/$defs/presentation_id"
    },
    "recipe_pair_material_ids": {
      "type": "array",
      "description": "The two resources this weapon is fabricated from, in authored order. The order is meaningful: the concatenation of the two resources' canonical letters, in this order, is the weapon ID's own suffix. The pair is unordered for uniqueness, which is why the catalog check sorts before comparing and this array does not.",
      "items": {
        "type": "string",
        "pattern": "^RSC-[0-9]{2}$"
      },
      "uniqueItems": true,
      "minItems": 2,
      "maxItems": 2,
      "x-authority": {
        "minItems": {
          "source": "GDD-WEAPON-CATALOG",
          "section": "Accepted catalog structure",
          "kind": "sourced",
          "derivation": "a weapon ID is a two-letter material pair, so the recipe names exactly two resources; the floor is the length of the ID's suffix"
        },
        "maxItems": {
          "source": "GDD-WEAPON-CATALOG",
          "section": "Accepted catalog structure",
          "kind": "sourced",
          "derivation": "the same two as the floor, because the pair and the ID suffix have to line up character for character; a third material would have no letter to correspond to"
        }
      }
    },
    "signature_mech_id": {
      "type": "string",
      "pattern": "^MCH-[0-9]{2}$",
      "description": "The mech that deploys with this weapon."
    },
    "behavior_kind": {
      "type": "string",
      "description": "The registered behavior. A lower-kebab-case token. Whether it resolves to exactly one registered behavior descriptor is the behavior registry's check and is deliberately not asserted here.",
      "pattern": "^[a-z][a-z0-9]*(-[a-z0-9]+)*$"
    },
    "targeting_policy": {
      "type": "string",
      "description": "The registered targeting policy. A lower-kebab-case token. Whether it resolves to exactly one registered behavior descriptor is the behavior registry's check and is deliberately not asserted here.",
      "pattern": "^[a-z][a-z0-9]*(-[a-z0-9]+)*$"
    },
    "rock_targeting_behavior": {
      "type": "string",
      "description": "The registered rock-targeting behavior. A lower-kebab-case token. Whether it resolves to exactly one registered behavior descriptor is the behavior registry's check and is deliberately not asserted here.",
      "pattern": "^[a-z][a-z0-9]*(-[a-z0-9]+)*$"
    },
    "ore_upgradeable_stats": {
      "type": "array",
      "description": "The three ore-upgradeable stat tracks, in slot order. A branch may not add a fourth, so these three are the whole vocabulary a branch's effects can name.",
      "items": {
        "$ref": "#/$defs/stat_track"
      },
      "minItems": 3,
      "maxItems": 3,
      "x-authority": {
        "minItems": {
          "source": "TDD-CONTENT-DATA",
          "section": "Weapons",
          "kind": "sourced",
          "derivation": "the section states that the compiler verifies exactly three stats, so the floor is that number rather than an independent capacity choice"
        },
        "maxItems": {
          "source": "TDD-CONTENT-DATA",
          "section": "Weapons",
          "kind": "sourced",
          "derivation": "the same three as the floor: 'exactly three' is one number, and a ceiling above it would admit a fourth stat that the compiler would then reject"
        }
      }
    },
    "fixed_properties": {
      "title": "A registry-owned parameter map",
      "description": "The weapon's fixed properties, keyed by its behavior kind. The key vocabulary belongs to the registered behavior descriptor rather than to this schema, so keys are not enumerated here; the strict codec still rejects a null, a duplicate key, and a non-snake_case key inside one.",
      "type": "object",
      "propertyNames": {
        "$ref": "#/$defs/snake_case_field"
      }
    },
    "global_attack_rate_mapping": {
      "title": "The global attack rate mapping",
      "description": "Arrays of timing names rather than one sentence each, so a future validator can check that every listed timing is a timing the weapon has. The timing vocabulary is not closed: no accepted document enumerates one, and closing it from fifteen authored sentences would be inventing it.",
      "type": "object",
      "additionalProperties": false,
      "properties": {
        "affected_timings": {
          "type": "array",
          "description": "The timings the global Attack Rate statistic reaches.",
          "items": {
            "type": "string"
          }
        },
        "unaffected_timings": {
          "type": "array",
          "description": "The timings it does not.",
          "items": {
            "type": "string"
          }
        }
      },
      "required": [
        "affected_timings",
        "unaffected_timings"
      ]
    },
    "branch_ids": {
      "type": "array",
      "description": "The three branch IDs, each beginning with this weapon's own ID. That they are one amplification, one functional and one conversion is asserted from the branches catalog, because branch_class lives on the branch.",
      "items": {
        "type": "string",
        "pattern": "^W-[A-F]{2}(-[a-z0-9]+)+$"
      },
      "uniqueItems": true,
      "minItems": 3,
      "maxItems": 3,
      "x-authority": {
        "minItems": {
          "source": "TDD-CONTENT-DATA",
          "section": "Weapons",
          "kind": "sourced",
          "derivation": "the section states one amplification, functional and conversion branch per weapon, which is three; a weapon with two could not have one of each"
        },
        "maxItems": {
          "source": "TDD-CONTENT-DATA",
          "section": "Weapons",
          "kind": "sourced",
          "derivation": "the same three as the floor; a fourth branch would be a second of one of the three kinds, and the section names each kind exactly once"
        }
      }
    },
    "base_automatic_attack_text": {
      "type": "string",
      "description": "The one-sentence catalog description of the automatic attack. Kept because the weapon's behavior is not otherwise represented, and it is the strongest argument for the behavior registry existing."
    },
    "base_behavior_text": {
      "type": "string",
      "description": "The multi-sentence behaviour description."
    }
  },
  "$defs": {
    "snake_case_field": {
      "title": "A schema-declared field name",
      "description": "Property names use snake_case.",
      "type": "string",
      "pattern": "^[a-z][a-z0-9_]*$"
    },
    "version": {
      "title": "A positive integer version",
      "description": "The initial schema_version and content_version of every first-authored definition is 1.",
      "type": "integer",
      "minimum": 1,
      "x-authority": {
        "minimum": {
          "source": "TDD-CONTENT-DATA",
          "section": "Initial versions",
          "kind": "sourced",
          "derivation": "the initial value of every first-authored definition is 1 and both versions only ever increment, so no valid version is below 1; there is no upper bound because a definition may be revised without limit"
        }
      }
    },
    "status": {
      "title": "Lifecycle state",
      "type": "string",
      "enum": [
        "development",
        "enabled",
        "disabled",
        "retired"
      ]
    },
    "name_key": {
      "title": "Localization key for the player-facing name",
      "type": "string",
      "pattern": "^[a-z][a-z0-9_]*\\.[A-Za-z0-9][A-Za-z0-9_-]*\\.name$"
    },
    "summary_key": {
      "title": "Localization key for the concise player-facing summary",
      "type": "string",
      "pattern": "^[a-z][a-z0-9_]*\\.[A-Za-z0-9][A-Za-z0-9_-]*\\.summary$"
    },
    "tags": {
      "title": "Closed query and tooling vocabulary",
      "description": "The vocabulary starts empty, so [] is the only accepted value.",
      "type": "array",
      "uniqueItems": true,
      "items": {
        "type": "string",
        "enum": []
      }
    },
    "source_refs": {
      "title": "The sources this definition implements",
      "type": "array",
      "uniqueItems": true,
      "items": {
        "type": "string",
        "pattern": "^(?:[a-z][a-z0-9_]*(?:\\.[a-z][a-z0-9_]*|\\[\\]|\\[[0-9]+\\]|\\[[0-9]+\\.\\.[0-9]+\\])*: )?(?:(?:GDD|TDD)-[A-Z0-9-]+|DEC-[0-9]{3}|TDR-[0-9]{3}|TR-[A-Z]+-[0-9]{3})(?:#[a-z0-9-]+)?$"
      }
    },
    "presentation_id": {
      "title": "Logical presentation entry, required absent",
      "description": "Required absent: a definition carrying this field is an error. No accepted document says what a presentation definition contains, so no ID grammar has been minted for one, and minting a shape for a category with zero members would be inventing structure ahead of need. The field was declared-optional with a non-empty-string constraint, which accepted any string an author invented and validated nothing about it; rejecting the field outright fails loudly the first time somebody adds one instead of accepting an unauthorized value. The subschema is 'not' over the empty schema, which rejects every instance, so the fault is the field's presence rather than its shape and an authored empty string is rejected by the same rule rather than as an empty declared-optional field. The typed validator reports MMC-2010 and names the field. When an accepted document mints a presentation ID grammar, this declaration becomes that grammar; until then it has no minLength, because a length bound on a value that can never be authored explains nothing.",
      "not": {}
    },
    "stat_track": {
      "title": "An ore-upgradeable stat track",
      "description": "One of a weapon's three tracks.",
      "type": "object",
      "additionalProperties": false,
      "properties": {
        "slot": {
          "type": "integer",
          "description": "The one-based track position.",
          "minimum": 1,
          "x-authority": {
            "minimum": {
              "source": "TDD-CONTENT-DATA",
              "section": "Unit and numeric policy",
              "kind": "sourced",
              "derivation": "the section makes integer currency and rank values integral in source; a count of things that exist begins at one, because a count of zero is the absence of the field rather than a value of it"
            }
          }
        },
        "name": {
          "type": "string",
          "description": "The track's name, which branch effects reference."
        },
        "unit": {
          "type": "string",
          "description": "The unit the two numeric values are measured in. The one place in the tree where a unit is a value rather than a name suffix, because rank_zero and increment_per_rank are a generic pair whose unit varies per row.",
          "enum": [
            "damage",
            "m",
            "activations-per-second",
            "damage-per-second",
            "seconds",
            "percentage-points-per-second",
            "count",
            "revolutions-per-second"
          ]
        },
        "rank_zero": {
          "type": "number",
          "description": "The value at rank zero.",
          "minimum": 0,
          "x-authority": {
            "minimum": {
              "source": "TDD-CONTENT-DATA",
              "section": "Unit and numeric policy",
              "kind": "sourced",
              "derivation": "the section states that durations are nonnegative and that rates cannot be negative, so the floor of every duration and rate is zero and there is no upper bound the section supplies"
            }
          }
        },
        "increment_per_rank": {
          "type": "number",
          "description": "What one common-ore rank adds. A track that does not improve with rank is not ore-upgradeable.",
          "exclusiveMinimum": 0,
          "x-authority": {
            "exclusiveMinimum": {
              "source": "TDD-CONTENT-DATA",
              "section": "Unit and numeric policy",
              "kind": "sourced",
              "derivation": "the section makes durations nonnegative and rates non-negative; this quantity is additionally one the definition divides by, scales by, or spends, so zero is excluded as well and the bound is exclusive rather than inclusive"
            }
          }
        },
        "discrete": {
          "type": "boolean",
          "description": "Whether the value only takes whole steps."
        }
      },
      "required": [
        "slot",
        "name",
        "unit",
        "rank_zero",
        "increment_per_rank",
        "discrete"
      ]
    }
  }
}
